{"format_version":"1.0","course_id":"4f32542066b44f4890cb6f6d765971ed","generated_at":"2026-10-03T14:14:18.973267Z","chapters":[],"nodes":[{"id":"kp_006121661ba1e339293914d86fad025e","course_id":"4f32542066b44f4890cb6f6d765971ed","name":"链队列的优点","aliases":[],"type":"theorem","definition":"链队列不会产生假溢出，也不需要预先确定容量，适合元素个数变化较大的场合。","level":0,"confidence":0.95,"status":"draft","source":"ai","locked":false,"revision":1},{"id":"kp_040b2bcb0d65cc65766749df4aac6dad","course_id":"4f32542066b44f4890cb6f6d765971ed","name":"栈和队列","aliases":[],"type":"concept","definition":"栈和队列是两种操作受限的线性表。","level":0,"confidence":0.95,"status":"draft","source":"ai","locked":false,"revision":1},{"id":"kp_05eb908d7bd3cadbe7845b5d281ee651","course_id":"4f32542066b44f4890cb6f6d765971ed","name":"栈","aliases":[],"type":"concept","definition":"栈（又称堆栈，英文 stack）是只允许在一端进行插入和删除操作的线性表，其操作特性为后进先出（LIFO）。","level":0,"confidence":0.95,"status":"draft","source":"ai","locked":false,"revision":1},{"id":"kp_1137a42595653d073a46ea754d5e4f1b","course_id":"4f32542066b44f4890cb6f6d765971ed","name":"中缀转后缀算法","aliases":[],"type":"method","definition":"从左到右扫描中缀表达式：操作数直接输出，左括号入栈，右括号则弹出并输出栈顶运算符直到弹出左括号，遇到运算符时先弹出并输出栈中优先级大于或等于它的运算符（遇左括号停止）再入栈，扫描结束后弹出栈中剩余运算符。","level":0,"confidence":0.9,"status":"draft","source":"ai","locked":false,"revision":1},{"id":"kp_1153aa1eb87550bd62a23cc324019c99","course_id":"4f32542066b44f4890cb6f6d765971ed","name":"出栈序列计数定理","aliases":[],"type":"theorem","definition":"n 个不同元素依次入栈，可能得到的不同出栈序列的个数等于第 n 个卡特兰数。","level":0,"confidence":0.95,"status":"draft","source":"ai","locked":false,"revision":1},{"id":"kp_154a5add769b23d118161023de6bef41","course_id":"4f32542066b44f4890cb6f6d765971ed","name":"栈的典型应用场景","aliases":[],"type":"example","definition":"撤销操作、回溯搜索和函数调用等需要“暂存后逆序处理”的场合，适合用栈。","level":0,"confidence":0.85,"status":"draft","source":"ai","locked":false,"revision":1},{"id":"kp_1bb4ac2371fedd76be3e62d0aea3bc4e","course_id":"4f32542066b44f4890cb6f6d765971ed","name":"队尾","aliases":[],"type":"concept","definition":"队列中允许插入元素的一端。","level":0,"confidence":0.95,"status":"draft","source":"ai","locked":false,"revision":1},{"id":"kp_2784333a45f872ae678c22ae931db97c","course_id":"4f32542066b44f4890cb6f6d765971ed","name":"出栈序列","aliases":[],"type":"concept","definition":"n 个元素按 1,2,…,n 的顺序依次入栈，入栈与出栈可以任意交错，可能得到多种不同的出栈序列。","level":0,"confidence":0.9,"status":"draft","source":"ai","locked":false,"revision":1},{"id":"kp_2a556a8838dc783fc15009279bfaa2ab","course_id":"4f32542066b44f4890cb6f6d765971ed","name":"队列的典型应用场景","aliases":[],"type":"example","definition":"任务排队、消息缓冲和逐层访问等需要“按到达先后依次处理”的场合，适合用队列。","level":0,"confidence":0.85,"status":"draft","source":"ai","locked":false,"revision":1},{"id":"kp_2bd7406980fcb22c1bc4cb62e98e27a1","course_id":"4f32542066b44f4890cb6f6d765971ed","name":"栈与队列的逻辑结构","aliases":[],"type":"theorem","definition":"从逻辑结构看，栈和队列与线性表完全相同，都是元素之间一对一的线性关系，二者的区别只在于允许进行插入和删除的位置不同。","level":0,"confidence":0.95,"status":"draft","source":"ai","locked":false,"revision":1},{"id":"kp_34e8c1e84be0c411e287f7ef9d8d55fb","course_id":"4f32542066b44f4890cb6f6d765971ed","name":"先进先出服务次序","aliases":[],"type":"concept","definition":"队列按先到先服务的方式工作，先到的请求先被处理，后到的请求在队尾等待，不会被插队。","level":0,"confidence":0.85,"status":"draft","source":"ai","locked":false,"revision":1},{"id":"kp_361d5cdf6461309c8e966080d6783c03","course_id":"4f32542066b44f4890cb6f6d765971ed","name":"空栈","aliases":[],"type":"concept","definition":"不含任何元素的栈称为空栈。","level":0,"confidence":0.95,"status":"draft","source":"ai","locked":false,"revision":1},{"id":"kp_46989da85cff2e63b3a81a060d9426a2","course_id":"4f32542066b44f4890cb6f6d765971ed","name":"链栈","aliases":[],"type":"concept","definition":"采用链式存储的栈称为链栈；通常用不带头结点的单链表实现，所有操作都在表头进行，表头指针就是栈顶指针。","level":0,"confidence":0.95,"status":"draft","source":"ai","locked":false,"revision":1},{"id":"kp_49bc90d9252196b03bbe65005b79fa87","course_id":"4f32542066b44f4890cb6f6d765971ed","name":"队列的缓冲作用","aliases":[],"type":"concept","definition":"队列适合处理需要按到达次序服务的问题，在请求到达速度与被处理速度不一致的场合起缓冲作用，先到的请求先被处理，后到的请求在队尾等待，既不会丢失也不会被插队。","level":0,"confidence":0.9,"status":"draft","source":"ai","locked":false,"revision":1},{"id":"kp_4c1e4627b6a20c739b0b3b2847fd5a52","course_id":"4f32542066b44f4890cb6f6d765971ed","name":"顺序实现与链式实现的选择","aliases":[],"type":"method","definition":"实际编程时，若元素个数的上限可以预先估计，通常优先选用顺序实现；若元素个数波动很大或无法估计，则选用链式实现更为稳妥。","level":0,"confidence":0.9,"status":"draft","source":"ai","locked":false,"revision":1},{"id":"kp_508118a78d3dacef2f090f6722fc6898","course_id":"4f32542066b44f4890cb6f6d765971ed","name":"循环队列元素个数计算公式","aliases":[],"type":"formula","definition":"循环队列中元素个数的计算公式为：(rear - front + MaxSize) % MaxSize。","level":0,"confidence":0.95,"status":"draft","source":"ai","locked":false,"revision":1},{"id":"kp_50dd341362ab95bd44de7e4d13f08bf7","course_id":"4f32542066b44f4890cb6f6d765971ed","name":"括号匹配实例","aliases":[],"type":"example","definition":"用串 [(]) 与 {[()]} 演示括号匹配过程：前者在读到 ] 时栈顶为 ( 而类型不符导致失败，后者扫描结束时栈为空因而匹配成功。","level":0,"confidence":0.85,"status":"draft","source":"ai","locked":false,"revision":1},{"id":"kp_53c208fb5f9f522f362c9f2bae49d84f","course_id":"4f32542066b44f4890cb6f6d765971ed","name":"栈与队列的存储结构","aliases":[],"type":"theorem","definition":"从存储结构看，栈和队列都可以采用顺序存储或链式存储。","level":0,"confidence":0.9,"status":"draft","source":"ai","locked":false,"revision":1},{"id":"kp_54d90179677039720f5673bb237d638d","course_id":"4f32542066b44f4890cb6f6d765971ed","name":"顺序栈与链栈的比较","aliases":[],"type":"theorem","definition":"顺序栈与链栈的入栈、出栈时间复杂度都是 O(1)；顺序栈需要预先估计容量，链栈则按需申请结点。","level":0,"confidence":0.9,"status":"draft","source":"ai","locked":false,"revision":1},{"id":"kp_5a9efe671385195aaccb2eb3a8f2a995","course_id":"4f32542066b44f4890cb6f6d765971ed","name":"队列的典型应用","aliases":[],"type":"example","definition":"队列的典型应用包括排队服务与广度优先遍历。","level":0,"confidence":0.95,"status":"draft","source":"ai","locked":false,"revision":1},{"id":"kp_5e0db526fb496250fae56ec2c15a0ff1","course_id":"4f32542066b44f4890cb6f6d765971ed","name":"栈的后进先出特性","aliases":[],"type":"theorem","definition":"栈的插入和删除都在同一端完成，因此最后到达的元素总是最先被处理。","level":0,"confidence":0.95,"status":"draft","source":"ai","locked":false,"revision":1},{"id":"kp_62398dd289be98370c6353b6fbeeff94","course_id":"4f32542066b44f4890cb6f6d765971ed","name":"递归工作栈","aliases":[],"type":"concept","definition":"每进入一层递归调用，系统就把当前层的返回地址、实参和局部变量作为一个工作记录压入递归工作栈；该层返回时再弹出这一记录，它是栈在程序运行时的典型应用。","level":0,"confidence":0.9,"status":"draft","source":"ai","locked":false,"revision":1},{"id":"kp_624822161f347618bfbbc2adc70a1dd2","course_id":"4f32542066b44f4890cb6f6d765971ed","name":"下溢","aliases":[],"type":"concept","definition":"对空栈执行出栈则发生下溢。","level":0,"confidence":0.9,"status":"draft","source":"ai","locked":false,"revision":1},{"id":"kp_6d648942eabcdb7e45d47f5fb3889d0b","course_id":"4f32542066b44f4890cb6f6d765971ed","name":"括号匹配算法","aliases":[],"type":"method","definition":"基于栈的后进先出特性，从左到右扫描表达式：遇左括号入栈，遇右括号时检查栈是否为空及栈顶左括号类型是否相符，扫描结束栈为空才算全部匹配成功。","level":0,"confidence":0.9,"status":"draft","source":"ai","locked":false,"revision":1},{"id":"kp_6ec5739b657edec26f3ba86486ce1be6","course_id":"4f32542066b44f4890cb6f6d765971ed","name":"后缀表达式","aliases":[],"type":"concept","definition":"把运算符放在两个操作数之后的写法，也叫逆波兰式；不含括号，计算次序完全由运算符出现的位置决定，适合计算机处理。","level":0,"confidence":0.95,"status":"draft","source":"ai","locked":false,"revision":1},{"id":"kp_702539b4e585e0edc6907416a51dd51f","course_id":"4f32542066b44f4890cb6f6d765971ed","name":"栈的基本操作","aliases":[],"type":"method","definition":"栈的基本操作包括初始化、判空、入栈、出栈和读栈顶元素。","level":0,"confidence":0.9,"status":"draft","source":"ai","locked":false,"revision":1},{"id":"kp_753c8dbaa1a0390aba18ca9b22e7eac2","course_id":"4f32542066b44f4890cb6f6d765971ed","name":"队头","aliases":[],"type":"concept","definition":"队列中允许删除元素的一端。","level":0,"confidence":0.95,"status":"draft","source":"ai","locked":false,"revision":1},{"id":"kp_75d8028fc8a101bcee880ea202c52b20","course_id":"4f32542066b44f4890cb6f6d765971ed","name":"阶乘的递归计算","aliases":[],"type":"example","definition":"计算 3! 时 fact(3) 调用 fact(2)，fact(2) 调用 fact(1)，递归工作栈中依次压入三层记录；fact(1) 返回 1 后逐层弹出，依次得到 fact(2) = 2 和 fact(3) = 6。","level":0,"confidence":0.85,"status":"draft","source":"ai","locked":false,"revision":1},{"id":"kp_7859387a026067defa483b360de0cadf","course_id":"4f32542066b44f4890cb6f6d765971ed","name":"表达式求值两步流程","aliases":[],"type":"method","definition":"表达式求值通常分两步完成：先用中缀转后缀算法得到后缀表达式，再用后缀表达式求值算法算出结果。","level":0,"confidence":0.85,"status":"draft","source":"ai","locked":false,"revision":1},{"id":"kp_80d0ddb1ccdacd933465ea79602ab59a","course_id":"4f32542066b44f4890cb6f6d765971ed","name":"链队列入队","aliases":[],"type":"method","definition":"入队在链表尾部插入结点。","level":0,"confidence":0.95,"status":"draft","source":"ai","locked":false,"revision":1},{"id":"kp_87431e2a3c3238d1a0ff189f86106b69","course_id":"4f32542066b44f4890cb6f6d765971ed","name":"操作受限的线性表","aliases":[],"type":"concept","definition":"栈和队列都是操作受限的线性表，即操作受到限制的线性表。","level":0,"confidence":0.9,"status":"draft","source":"ai","locked":false,"revision":1},{"id":"kp_87de6994600f658b2eb49b01fa563b84","course_id":"4f32542066b44f4890cb6f6d765971ed","name":"先进先出","aliases":[],"type":"theorem","definition":"最先进入队列的元素最先离开，是队列的操作特性，与栈的后进先出相反。","level":0,"confidence":0.95,"status":"draft","source":"ai","locked":false,"revision":1},{"id":"kp_8f206ead788918fb472df2697225e757","course_id":"4f32542066b44f4890cb6f6d765971ed","name":"递归的栈溢出问题","aliases":[],"type":"theorem","definition":"递归算法结构清晰，但层数过深时递归工作栈会占用大量空间，甚至导致栈溢出。","level":0,"confidence":0.85,"status":"draft","source":"ai","locked":false,"revision":1},{"id":"kp_920fd6f5e67a4c2e6a7375eb0d56b5f2","course_id":"4f32542066b44f4890cb6f6d765971ed","name":"栈和队列的存储实现","aliases":[],"type":"concept","definition":"栈和队列的两种实现方式都直接沿用线性表的顺序存储与链式存储，因此学习前需要先掌握线性表的顺序存储与链式存储。","level":0,"confidence":0.85,"status":"draft","source":"ai","locked":false,"revision":1},{"id":"kp_93c062720f236e6dcde251142166824b","course_id":"4f32542066b44f4890cb6f6d765971ed","name":"出栈","aliases":[],"type":"method","definition":"出栈（Pop）是删除栈顶元素并返回它。","level":0,"